{"$schema":"https://json-schema.org/draft/2020-12/schema","$id":"https://aetherion.local/schemas/capture-manifest-v1.json","type":"object","required":["schema","project","tick","world_checksum","image_checksum","path","format","dimensions","camera","visible_entities"],"properties":{"schema":{"const":"aetherion.capture/v1"},"project":{"type":"string"},"tick":{"type":"integer","minimum":0},"world_checksum":{"type":"integer"},"image_checksum":{"type":"integer"},"path":{"type":"string"},"format":{"enum":["ppm-p6","png"]},"dimensions":{"type":"object"},"camera":{"type":"object"},"visible_entities":{"type":"array"},"channels":{"type":"array","items":{"type":"object","additionalProperties":false,"required":["name","file","encoding","checksum","dimensions"],"properties":{"name":{"enum":["depth","normals","segmentation"]},"file":{"type":"string"},"encoding":{"enum":["pgm-p5-u16be","png-rgb8","png-rgb24-id"]},"checksum":{"type":"integer"},"dimensions":{"type":"object"}}}},"segmentation_mapping":{"type":"array","items":{"type":"object","additionalProperties":false,"required":["value","entity_id","name"],"properties":{"value":{"type":"integer","minimum":1,"maximum":16777215},"entity_id":{"type":"integer","minimum":0},"name":{"type":"string"}}}}}}